text,label,pred_rubert_tiny2 (seara),pred_multilingual_tabularisai,pred_xlm_roberta_multilingual (cardiffnlp)
"*кивает* Я знаю печальную реальность. Хотя я предполагал, что он не в такой ситуации, основываясь на том, что он сказал.",negative,negative,very negative,negative
"Похоже, кто-то облажался.",negative,neutral,very negative,negative
"Да, это действительно разочаровывает",negative,neutral,negative,negative
"Но если мы пойдем в ФТС прямо сейчас и больше никогда не будем играть с вами в ватную миску, мы сохраним шляпу.",neutral,neutral,very negative,neutral
"Э-э-э, я не знаю, мне до сих пор неловко говорить о «[ИМЯ]» и все такое.",negative,negative,negative,negative
"Мы все люди, почему бы темнокожему [ИМЯ] не быть «своим»?",neutral,neutral,negative,negative
"[ИМЯ] все в порядке, трубач больше не сможет причинить тебе вреда",positive,neutral,very positive,positive
Генеральный менеджер Reddit здесь. Кто-нибудь наймите этого гения.,positive,neutral,neutral,positive
Теперь это имеет смысл.,neutral,neutral,neutral,positive
"Я тоже делаю 4-секундный перерыв, и меня бесит, когда кто-то этим пользуется.",negative,negative,positive,negative
"Да, мне тоже не нравится мнение моего друга",negative,neutral,negative,negative
"Лол, вот почему я теряю свои игры, потому что играю с такими ботами, как ты. Сделай миру одолжение и тоже вернись в майнкрафт лол",negative,negative,positive,negative
"Аутизм (механистическое мышление, отсутствие теории разума) является противоположностью интуиции (мышления без мышления).",neutral,neutral,neutral,negative
"О господи, это противно. Думаю, сегодня вечером я съем жареную курицу.",neutral,negative,very negative,negative
"Ты не мой STBXH, хе-хе. Он печатает не так, как ты.",negative,negative,negative,negative
"Ха-ха, мне, наверное, следует уточнить, что это семейная собственность и управление.",positive,neutral,positive,neutral
"Просто лучший WR в лиге, ретвитящий лучшего TE в лиге, здесь не на что смотреть....",neutral,positive,very positive,positive
С днем ​​рождения твоего друга!,positive,neutral,very positive,positive
"Уже не так рад, что у нас будет самый трудный второй тайм в НХЛ...",negative,neutral,negative,positive
"Не делай пункт 4, это чушь",negative,negative,negative,negative
"Я здесь, чтобы сказать вам, что все действительно получится! Я определенно чувствовал себя так же, как вы раньше. Плохо чувствовать себя одиноким.",negative,negative,positive,negative
"Меня бы очень беспокоила такая зависимость от Человека. Я уверен, что есть способ обойтись без человека, спонсирующего Вас.",neutral,neutral,very negative,negative
"Иногда мне хочется, чтобы он прочитал мою",positive,neutral,negative,neutral
"Я имел в виду, что это знак для других, что он криптонацист. Моя вина, я не совсем ясно выразился.",negative,negative,negative,negative
"Пожалуйста, дайте нам обновления. Ух ты.",positive,neutral,very negative,negative
"Он не уверен, что это все еще актуально.",neutral,neutral,negative,neutral
"Нет, никаких форм или чего-то еще. Я умолял их не идти, и казалось невероятным, что меня заставляют идти.",negative,negative,very negative,negative
"Ваааа, ох, они массаааа... ПЕРЕСТАНЬТЕ. ВЫ МОЖЕТЕ ПОВЕСТИ КАК МУЖЧИНА.",negative,positive,very positive,positive
!Напомнить мне 10 дней,neutral,neutral,very positive,neutral
"Большинство людей, комментирующих в /r/Libertarian, не являются либертарианцами, а просто хотят сказать либертарианцам, насколько они глупы и злы.",negative,negative,negative,negative
"Возможно, я слишком осторожен, но когда я был одинок, я держался подальше от людей, которые со мной работали.",neutral,neutral,very negative,neutral
Ведь никто в этом мире не хочет видеть тебя счастливым и довольным мужчиной!,negative,positive,very positive,negative
"Их число кажется большим, потому что они получают так много рекламы. Но я подозреваю, что даже большинство молодых людей находят это смехотворным.",positive,neutral,very negative,negative
"Моя мама работает в НАСА и, судя по всему, нет. Они дали им брошюры с номерами кредитных агентств и советами по получению кредитов, лол. Это ужасно.",neutral,negative,negative,negative
"Я рад, что закончил смену пораньше, чтобы расслабиться и поиграть в казино... Со вчерашнего дня у меня были некоторые проблемы... пришлось закрыть приложение/перезапустить, чтобы продвинуться дальше.",neutral,neutral,negative,positive
"Я атеист, и идея бога вызывает у меня отвращение и злость, поэтому я предпочитаю не быть религиозным.",negative,negative,negative,negative
"То есть, даже столкнувшись с неопровержимыми доказательствами, вы удвоили ставки? Мой мужчина",positive,neutral,very negative,neutral
его ловушки скрывают гребаное солнце.,neutral,neutral,neutral,neutral
НО КТО БУДЕТ СТРОИТЬ ДОРОГИ?,neutral,neutral,neutral,neutral
"мне было бы очень не по себе, зная, что я никогда не смогу посетить другие страны, думаю, я бы предпочел 50 тысяч",negative,neutral,negative,negative
"Есть причина, по которой в южных штатах наблюдается массовая нехватка учителей. Пожалуйста, сделайте себе одолжение, подумайте об этом, прежде чем совершить прыжок.",neutral,negative,negative,negative
"Лол, вспышка прошла, но я все еще упрям. В ходе этого разговора я постараюсь вернуться, как только буду готов.",positive,neutral,negative,positive
>Я легко отвлекаюсь. Я откладываю работу ради этого опроса :(,positive,neutral,positive,negative
"Кстати, у меня вчера это не сработало в Safari, но это было во время [ИМЯ], так что, возможно, Apple оказала мне хорошую услугу.",negative,neutral,negative,positive
"12 – это амбициозно!! Я сделаю это с тобой, но моя цель будет 4",positive,positive,very positive,positive
"Привет, [ИМЯ]! Я решил зайти и пожелать вам чудесного и процветающего года! Удачи! -HappyFriendlyBot",positive,positive,very positive,positive
"Поздравляю чувак! Надеюсь, моя ситуация изменится так же сильно, как и твоя.",positive,positive,very positive,positive
Уделите мне время!,neutral,neutral,positive,neutral
"Со мной было все в порядке, пока я не попал в отделение интенсивной терапии.",negative,neutral,negative,neutral
"Америка — наименее сознательная страна в мире, так что это не должно быть сюрпризом. все думают, что однажды они станут менеджерами, так что это круто",positive,neutral,very positive,positive
(4) Доставить сексуальные удовольствия,neutral,positive,neutral,positive
"Она ужасный человек, и именно это делает ее такой близкой в ​​реальной жизни.",negative,negative,very negative,negative
"Всё круто, когда никто не пострадал.. Но как только случается что-то плохое, мы все кричим идиоты... Почему...?",negative,negative,very negative,negative
Это невероятно обескураживает.,negative,positive,very negative,negative
"Мне жаль, что я могу дать только один голос за эту замечательную, наглядную и точную визуализацию.",negative,positive,very positive,negative
Это точно сотрясение мозга легкой или средней степени тяжести с возможным переломом черепа.,neutral,neutral,neutral,negative
"Я даю 90-процентную вероятность того, что [ИМЯ] будет переизбран. И я думаю, что маржа будет гораздо выше, чем в 2016 году.",positive,neutral,negative,neutral
"Мне сказали, что я выгляжу как [ИМЯ] с хвостиком, но я хочу выглядеть как [ИМЯ]",negative,positive,negative,neutral
"Это то, что дети делают на своих стримах на Twitch, чтобы получить подписки, что довольно грустно.",negative,neutral,negative,negative
"Я думаю, мы оба знаем, почему :P, как видите, люди съедают все, что слышат.",neutral,neutral,neutral,positive
"Хорошо, надеюсь, он действительно примет это близко к сердцу!",positive,positive,positive,positive
"Не испорчен. Если это были постоянные коронки, они вернутся на место. Источник: У меня 14 крон. Не рекомендую.",negative,negative,negative,positive
"Интересно наблюдать, как Dashy и Crimsix меняют специалистов. А Скамп использует Stock 2 на своем Saug. Кажется, они пробуют что-то новое.",neutral,neutral,positive,positive
"Ух ты. Если в счете отображаются звонки, то какая в этом польза? Рад, что спросил...",positive,neutral,neutral,positive
"Несмотря на этот инцидент, она любит своих собак. Но спасибо за ваш вклад, господин [ИМЯ].",positive,positive,very negative,positive
"Все это справедливо, но вам следует начать мыть посуду сразу после ее использования. Вы будете намного счастливее.",neutral,neutral,positive,positive
"Неправильно, вот где мы прячем фанки",neutral,neutral,negative,negative
"Оцените обновление, но надеюсь, что оно правильное!",positive,neutral,negative,positive
"Жалко, что не расстреляли негодяев😡😡😡😡",negative,negative,very negative,negative
любил этот в детстве,positive,neutral,positive,positive
"Я пришел сюда, чтобы сказать это.",neutral,neutral,neutral,positive
"Есть ли у вас данные, позволяющие предположить это?",neutral,neutral,neutral,neutral
"У вас должна быть точка доступа, которая уважает вас... а не просто хочет вас использовать.",negative,neutral,neutral,positive
"Я пытался подчеркнуть, что у пациента все еще есть припадок; это просто не видно, потому что они парализованы.",negative,neutral,negative,neutral
"Ценю тебя, братан",positive,neutral,negative,positive
Бесплатная рыба... приятно,positive,positive,positive,positive
"Тогда она не похожа на хорошую девушку, если предположить, что ты не сделал ничего, что оправдывало бы такую ​​ревность.",negative,neutral,negative,negative
Что там с покупкой порно? я это пропустил,negative,neutral,neutral,negative
"О, [ИМЯ]. Так что это похоже на выстрел в голову из пули 50 калибра.",neutral,neutral,very negative,negative
Освобождение от смерти мозга. Честно заслуженное лидерство. Они стали лучше.,neutral,neutral,positive,positive
"Нет, это значит, что тебе на самом деле 41.",negative,neutral,negative,neutral
Блин... 😑,negative,neutral,positive,negative
интересной сделкой будет [ИМЯ] и первое место в составе «Мавс» для [ИМЯ]. и [ИМЯ],neutral,positive,neutral,positive
"Возможно, у нее был плохой день. Но опять же, по крайней мере, поздороваться.",negative,neutral,very negative,positive
"Конечно, жизнь становится лучше. Просто продолжайте в том же духе, и я надеюсь, что вы передумаете.",positive,neutral,very positive,positive
"А еще был тот, кто схватил маму за грудь и попытался засунуть ее в рот ребенку.",negative,neutral,very negative,negative
"Ой, я даже таких не нашел! Хотя это забавно.",neutral,negative,negative,positive
"Лол, я контролирую твою жизнь, чушь, кстати, открой чат",positive,neutral,very positive,neutral
С Днем микрофона!,positive,neutral,very positive,positive
Мне без иронии нравится эта песня,positive,positive,positive,positive
Его отрывки были сняты в июне.,neutral,neutral,neutral,neutral
Я СОБИРАЮСЬ ОТКЛЮЧИТЬСЯ,neutral,positive,neutral,negative
Хотя это факт. Так что ваши обвинения просто основаны на дезинформации.,negative,neutral,very negative,negative
"""бросай ритм *АЙЫЫЫЫЫЫЫ........ООООООООООООООО""*",negative,positive,neutral,negative
"Нееврей – это прекрасный термин (не такой ироничный, который используют сторонники превосходства белой расы). Вы не согласны?",positive,neutral,negative,positive
Эта бедная душа,negative,negative,very negative,negative
"Да ты облажался, пацан. Все, что вам нужно было сделать, это победить.",negative,negative,very negative,positive
"Совсем не кража, но это примерно в 100 раз больше суммы, которую он когда-либо успешно защищал.",neutral,neutral,negative,negative
"То же самое, я надеюсь, что моя предстоящая поездка убьет меня.",negative,neutral,positive,negative
"хорошая попытка, приятель",positive,positive,positive,positive
"У Мексики определенно был большой потенциал для процветания, но затем весь бардак, начавшийся в 1910-х годах и приведший к PRI, действительно все это подавил...",neutral,neutral,positive,negative
Эта собака такая милая,positive,positive,negative,positive
"Лмао, я слушаю вещи, которые не вписываются ни в одну из этих категорий. О, и внук.",positive,neutral,negative,neutral
"Нет, они все равно ушли, хотя и знали, что у меня трудный период :)",negative,neutral,very negative,positive
"Сначала они пришли за социалистами, а я не высказался...",neutral,neutral,negative,negative
"Две овертаймы в воскресном чемпионате? Мы благословлены как футбольные фанаты. Жаль, что одна игра должна была быть между FYTB и FUKC.",positive,neutral,negative,negative
"Не знал, что они проводят матчи на меньшем поле, чтобы посмотреть, как они справятся с меньшим временем реакции. Думаю, это было интересно.",neutral,neutral,negative,positive
Это ужасно,negative,negative,very negative,negative
"Если вы хотите играть с людьми, используйте дискорд Call of Duty, так как у них есть лфг для зомби, и он довольно активен.",positive,neutral,positive,positive
На прошлой неделе я проколола нос! Так здорово иметь свободу. :),positive,positive,very positive,positive
"Я думаю, что если сделать кого-то одобренным отправителем, можно обойти эту проблему. Хотя не на 100% уверен.",positive,neutral,negative,positive
"Она также может сказать, что привержена государственной системе, но при этом желает двухуровневой системы. Так что то, что она там сказала, действительно ничего не значит.",neutral,neutral,negative,neutral
"Полагаю, поскольку у [ИМЯ] истекает срок действия, а вы, ребята, танкуете, это не имеет большого значения.",negative,neutral,negative,neutral
"Да, когда я в последний раз проткнул волдыри, вы разозлились.",neutral,negative,negative,negative
"Но в первую очередь вы думаете, что внешние факторы являются более важным фактором. В конце концов, это правда.",neutral,neutral,negative,neutral
Боже мой. Я бы положил его вверх дном на стол и пошел.,positive,neutral,negative,negative
Лучше это будет чертов дерьмовый пост.,negative,negative,positive,negative
"> Практически человек, которого я люблю, только что окончательно расстался со мной. Через сколько времени?",negative,neutral,very negative,neutral
"Действительно, это так! Единственная жалоба заключается в том, что кентрозавр чертовски колючий, и я довольно часто нахожу его ногой в темноте...",positive,negative,very negative,negative
Для серийных насильников дело не в физическом удовольствии. Это все игры с головой. Чертовы уроды,negative,negative,very negative,negative
"Лучше не надо, потому что я купил эту чертову штуку только на прошлой неделе! Извините, думаю, я все еще в шоке от того, что чайник умер.",neutral,negative,very negative,negative
"Эй, киддан, братан. Ты из Детройта?? 🤣🤣",neutral,neutral,very negative,neutral
"Чувак, я рад, что подпись сказала мне, что это весело... иначе я бы не узнал.",positive,positive,negative,positive
"Я не думаю, что они считают геометрические узоры абстрактным искусством.",neutral,neutral,neutral,neutral
Спросите Волшебный шар-восьмерку позже. Мы не можем предсказать ваше будущее.,negative,neutral,negative,neutral
Это действительно следующий уровень,neutral,neutral,positive,positive
Его интервью такие неловкие,neutral,neutral,negative,negative
[ИМЯ] Продолжительность 12 минут? Еще одно минутное видео меня испортило.,neutral,negative,neutral,negative
[ИМЯ] на самом деле был крут в этом эпизоде.,neutral,positive,positive,positive
Типичный. Фу,neutral,neutral,positive,negative
Просто прочитайте текст этой поправки. Меня буквально тошнит от прочтения этого. ЭТО НЕ ДОЛЖНО СТОЯТЬ!!,negative,negative,very positive,negative
"Извините, на самом деле [ИМЯ] управляет этим сайтом. [ИМЯ] ведет ежедневную телеграмму. И я не видел там места, где бы она это говорила.",negative,negative,negative,neutral
Вы хотя бы ПОПРОБУЕТЕ ПОПРОБУТЬ???,negative,neutral,neutral,neutral
"Что может быть страшнее желтого человечка? Желтый человек, использующий желтый цвет",neutral,neutral,very negative,negative
"Я с нетерпением ждал этого. Но, черт возьми, я надеялся на какую-нибудь эпическую историю о мести ;-;",negative,neutral,negative,positive
Самый лучший бой.,positive,positive,very positive,positive
"Блин, это сексуально",positive,neutral,positive,positive
"Признаюсь, я посмеялся над этим",positive,neutral,positive,positive
"Такой же. Примерно такой же либертарианец, как чертов [ИМЯ].",neutral,negative,negative,negative
Благослови свое сердце,neutral,positive,very positive,positive
"Я очень рад впервые познакомиться с Денвером! Все, что я слышал, это то, как это удивительно",positive,positive,positive,positive
"«Полиция уже в пути, мэм, просто сохраняйте спокойствие».",neutral,neutral,positive,positive
"Инстинкт и интеллект — противоположности, никогда не говорили, что они одно и то же.",negative,neutral,negative,neutral
Слабый должен бояться сильного,negative,neutral,negative,negative
"Бедному коту надрали задницу краб, веревка и метла.",negative,negative,neutral,negative
Как. Только как,neutral,positive,neutral,positive
Разве это не онлайн-исследование?,neutral,neutral,neutral,neutral
На это уйдет куча эко-продуктов.,positive,neutral,neutral,negative
"Она не герой, которого мы заслуживаем, она герой, который у нас есть.",negative,neutral,negative,positive
"У меня нет мыслей, которые можно было бы безопасно опубликовать публично.",negative,neutral,negative,negative
"Каждый раз, когда я смотрю игру T-Wolves и вижу, как [ИМЯ] бегает в футболке с номером 67, я просто смеюсь.",positive,positive,neutral,positive
