text,label,pred_rubert_tiny2 (seara),pred_multilingual_tabularisai,pred_xlm_roberta_multilingual (cardiffnlp)
"США собираются так жестко трахнуть этого парня [ИМЯ]... ему понадобится помощь, чтобы удалить все звезды из его прямой кишки",neutral,neutral,negative,negative
Лиге лучше поступить правильно с нами и подарить нам Сион. Они сделали это и для Нолы и Кливленда… мне нужно во что-то верить… пожалуйста!,neutral,neutral,positive,positive
Мой второй доктор! Я студент из Кливленда и буду рад любым вашим советам.,positive,positive,very positive,positive
"Тебе надо поработать, чувак!! Если ты не уверен, что не готов, приведи себя в порядок, И все встанет на свои места.",positive,neutral,very positive,positive
Это максимально близко к пению в реальной жизни. Это весело.,positive,positive,positive,positive
"> Мы злимся, но не хотим, чтобы нас называли жестокими психами.",negative,negative,very negative,negative
Я бы поставил Thielen TD против Packers на первое место. Это была потрясающая игра [ИМЯ] и [ИМЯ].,positive,positive,neutral,positive
* Фаворит — [ИМЯ] * Наименее всего — [ИМЯ] (исключая [ИМЯ]) * Переоценён [ИМЯ] * Недооценён [ИМЯ],positive,neutral,neutral,negative
"Какая логика оправдывает 33 доллара, но не оправдывает 5000 долларов?",neutral,neutral,neutral,neutral
"Это скорее спорные мнения, а не непопулярные.",positive,neutral,negative,neutral
"Это было бы круто, не так ли? Спасибо!!",positive,positive,very positive,positive
"Милое имя]. Да. Он. Мы люди. Мы женаты. Смотри, если хочешь.",neutral,neutral,positive,positive
У меня была самая большая улыбка!,positive,positive,very positive,positive
И этот парик ужасен,negative,negative,very negative,negative
"Спасибо ! Мне показалось это забавным, думаю, никто этого не заметил и не подумал, что это смешно:/",positive,positive,very negative,positive
Ну это отстой. Я имею в виду восстановление соединения и сохранение ваших очков крови. Случайное и целенаправленное разъединение кажется справедливым.,negative,negative,positive,positive
С любовью,positive,positive,positive,positive
Это звучит просто и хорошо,positive,positive,positive,positive
"Честно говоря, я не могу себе представить, чтобы [ИМЯ] использовал какую-либо ненормативную лексику лол",positive,neutral,negative,negative
"То, что что-то является вопиющим, не означает, что другое действие не является таким вопиющим.",negative,negative,negative,neutral
у него было дерьмо,negative,negative,negative,negative
"Ах да, не заметил имя пользователя. Да, пожалуйста, сделай. Я совсем недавно увлекся фотографией. Полный нуб, но мне это нравится.",positive,positive,positive,positive
Новое для меня слово: tetch·y /ˈteCHē/ прилагательное вспыльчивый и раздражительный. «Она всегда была с ним раздражительной и нетерпеливой»,negative,neutral,positive,negative
"Это действительно вопрос принципа. Сейчас он маленький, и это только побудит его взять больше в следующий раз.",neutral,neutral,negative,neutral
"Какое отношение к этому имеет Obamacare? [ИМЯ] отказался от мандата работодателя, потому что боялся, что [ИМЯ] это не понравится.",neutral,negative,negative,negative
"[ИМЯ]? Как в дерьме святого Джимми, которое в наши дни появляется в каждом магазине?",neutral,negative,neutral,negative
Это слишком сильный пассив,negative,neutral,negative,negative
"К несчастью для него, но я воспитываю игроков. >И они могут просто перестать быть опорой.",negative,neutral,negative,neutral
"Если это настоящая фармацевтика, то я буду брать 7 или 8 долларов за таблетку. Я никогда не плачу больше 5 за настоящие, но 8 долларов все равно вполне справедливо.",negative,neutral,neutral,positive
"Я не чувствую, что его кто-то винит",neutral,neutral,negative,neutral
"Спасибо, я стараюсь свести наши контакты к минимуму.",positive,positive,neutral,positive
Враждебный ? Я не согласен.,negative,neutral,very negative,negative
Спасибо!!,positive,positive,very positive,positive
"Если я потерплю неудачу, у меня все еще будет некоторый опыт выслеживания людей. Может пригодиться, если я когда-нибудь захочу работать в полиции :P",positive,neutral,neutral,positive
Жуткая долина жутких.,negative,neutral,neutral,positive
"Счастлив, что у него не только один день рождения, но и мяч, который он бросил на трибуны после середины 9-го иннинга.",positive,neutral,neutral,positive
И? Оскорбительные люди тоже мило извиняются. Это не делает их менее агрессивными и неправыми.,negative,negative,negative,positive
...начинается 1 января. «Опубликовано 2 января» Отличный способ рассказать о последних новостях.,neutral,positive,neutral,positive
Плохой каламбур может сильно разозлить,negative,neutral,negative,negative
"И, судя по всему, она тогда все равно была беременна, потому что именно тогда они расстались, и она призналась, что это произошло, когда они были вместе!",neutral,negative,very positive,neutral
"5280, чувак.",positive,neutral,neutral,neutral
"БФ: Если ты мне не веришь, приходи. *подруга идет в дом парня, видит парня* подруга- Хммм, возможно, мне это снится.",neutral,neutral,neutral,neutral
О боже 😂. Я верю в это!!,positive,positive,very positive,positive
Сделанный! Удачи!,positive,positive,positive,positive
Ржу не могу! Но мне нравится твоя фамилия. XD,positive,neutral,positive,positive
">Кот, детка, с тобой что-то не так",negative,neutral,negative,negative
"«Приятно видеть, что лучше не становится».",positive,positive,positive,positive
"Я ненавидел [ИМЯ], но только потому, что считал его хорошим игроком и играл за «Ковбоев». Я чувствую то же самое по отношению к [ИМЯ] и [ИМЯ].",negative,neutral,very positive,negative
"Учитывая огромное количество сезонных специалистов, нанятых в этом году, я не удивлюсь.",neutral,neutral,negative,positive
"Так трудно поверить, что этот комментарий не высмеивается. Я хочу немного того, что вы, ребята, курите.",negative,neutral,negative,negative
"Я имел в виду, что наказание за установку мины в некоторых штатах выше, чем за кражу холодильника.",positive,negative,negative,neutral
Пушистому сообществу это нравится.,positive,positive,positive,positive
Будь ты проклят и твои факты.,neutral,negative,negative,negative
"Что, если... >Valve удалит дату, чтобы не создавать впечатление, что они сообщают расчетное время прибытия",neutral,neutral,neutral,neutral
"Это не имеет большого значения, потому что с тех пор, как BF вышел на консоли, он постепенно стал дерьмом. :)",negative,negative,negative,positive
"Тот факт, что об этом вспоминают, вызывает по-настоящему пугающее чувство.",negative,neutral,very negative,negative
"Это очень запоминающаяся и приятная песня, она мне очень нравится. Не все должно быть лирическим чудом, духовной индивидуальной музыкой.",positive,positive,positive,positive
"Спасибо. Это сводило меня с ума. Я думал, что ее ответом будет то, что она поправит его.",positive,positive,positive,negative
"Я смеялся сильнее, чем следовало",positive,positive,positive,positive
"Дааааа хаха, объективно это не ОТЛИЧНЫЕ фильмы 😅",neutral,positive,very negative,positive
Как никто из тренерского штаба не пытался помешать [ИМЯ] прийти и убить нас?,neutral,neutral,neutral,negative
"что это за приложение? я время от времени вижу макет, мне просто интересно",neutral,neutral,positive,neutral
"ох блин, мне жаль это слышать. это был кто-то из твоих близких?",negative,negative,very negative,negative
"Я тоже могу насрать на [ИМЯ] и [ИМЯ], если хочешь ;) Вива [ИМЯ]",negative,neutral,neutral,positive
"Наверняка вы читали правила этого подпункта. Давай, мужик.",positive,neutral,negative,neutral
"Я всегда считал [ИМЯ], [ИМЯ] и [ИМЯ] красивыми.",positive,positive,positive,positive
"Точно так же Reddit в последнее время стал странным, извините за неправильное толкование.",negative,neutral,negative,negative
Вы действительно вдавались в детали и приводили веские аргументы. Δ,positive,neutral,neutral,positive
Убить всех людей,negative,neutral,positive,negative
"Это круто. Я не знал, что у них есть такие камеры. Спасибо, что поделились :)",positive,positive,very negative,positive
Леди выглядит немного психопаткой,negative,positive,negative,negative
почему за это минусуют?,negative,neutral,neutral,negative
"Обсуждайте и отслеживайте случаи, процедуры в каждом случае различны. Это странно. Это единственное убеждение на земле, где мы видим это.",neutral,neutral,neutral,negative
"Блин, почему я об этом не подумал",negative,neutral,negative,negative
"Кусая руку, которая их кормит",negative,neutral,very negative,neutral
Делать деньги на деньгах отвратительно и разрушает экономику.,negative,negative,very negative,negative
"Я все еще удивлен, что у этой штуки всего две полосы движения в каждом направлении.",neutral,neutral,neutral,negative
"Да, извини, я не знаю британца или канадца.",negative,neutral,neutral,neutral
Это не входило в мой план,neutral,neutral,negative,negative
"Я думаю, моя жена будет смеяться над этим, я попробую сегодня вечером!",positive,positive,very positive,positive
"Хах, да, неудобно писать об этом банкомате ^^; это было совсем недавно, когда мы расстались-",negative,negative,negative,negative
"Могу поспорить, он настаивает на том, что любит вас обоих, потому что для него любовь — это просто удовлетворение его потребностей.",positive,positive,positive,positive
"Дайте мне знать, как вам это нравится!",neutral,positive,positive,positive
Я люблю рубашки поло,positive,positive,negative,positive
"Подождите, пока не придет тайный водопроводчик. (Возможно, это один из самых непонятных комментариев, которые я когда-либо писал.)",positive,neutral,very negative,negative
Мы выглядим как Ястребы в это время. Старые добрые времена,positive,neutral,neutral,negative
"[ИМЯ], она действительно моя наименее любимая королева, которую я затягиваю в историю гонок. Скучный, вымученный и неудачный макияж.",negative,positive,very negative,positive
"Я имею в виду, да, я бы немного пожаловался. Но тогда я бы съел все это дерьмо.",positive,negative,negative,negative
"Вторая цитата: [ИМЯ], Я буду помнить тебя. Она отличная певица :)",positive,positive,positive,positive
"Спасибо ОП, что не попался на удочку.",positive,positive,negative,negative
"Это было хорошо использовано. Спасибо за вашу службу, сэр.",positive,positive,positive,positive
"Это то, чего я хочу больше всего сейчас, когда [ИМЯ] ушел, но я думаю, что мы живем в мире НЕТ",positive,negative,very positive,neutral
"Верно, но я думаю, что, по крайней мере, другой автор думал именно так.",positive,neutral,negative,neutral
"Свободное рыночное здравоохранение. Узнайте, чего такие страны, как Дания, могут добиться в сфере здравоохранения за счет налогообложения. Должно быть, это коммунистическая пропаганда.",positive,neutral,neutral,negative
«Оооооооооо... Я *вижу* музыку!»,neutral,positive,very positive,positive
"Я не могу носить свои каждый день, но мне нравятся леггинсы от Forever 21. Они удобные и стоят менее пяти долларов за пару.",positive,positive,positive,positive
"**ВЫБИРАЙТЕСЬ, НОРМЫ! ВНЕ!**",neutral,positive,very positive,negative
Стреляй в него или типа того.,negative,neutral,neutral,neutral
"По их словам, вполне допустимо иметь близость с женщиной, а затем заблокировать ее номер. Ржу не могу.",positive,neutral,negative,negative
"Большое спасибо, я, должно быть, пропустил это, пока у меня не было постоянного доступа в Интернет. Извините, что включил вас в список по ошибке.",neutral,neutral,very negative,negative
"Я сожгу X, если мы проиграем эту игру сегодня вечером.",neutral,negative,very negative,negative
"Я веган, и это для меня большое нет.",negative,negative,negative,neutral
Он играет с моими эмоциями и моим фэнтезийным хоккейным пулом....,negative,neutral,positive,positive
"Или, возможно, нам следует взглянуть на более серьезную проблему: психиатрическую помощь в Соединенных Штатах.",positive,neutral,negative,neutral
"Люблю тебя, [ИМЯ]",positive,positive,positive,positive
"Я имею в виду, я рад, что мы поддерживаем полет человека в космос и что в зале суда были призраки?",positive,neutral,neutral,positive
"У меня тоже мигрень, и я очень устаю в первые два дня менструации.",neutral,neutral,positive,negative
"Я люблю каждую выпуклость, шрам, растяжку и покачивание. Каждый рассказывает историю, которую я хочу услышать.",positive,positive,positive,positive
"Кроме того, вы с большей вероятностью будете повторять ошибки.",positive,neutral,negative,negative
"Помните, ребята, вы можете посетить сайт, чтобы сообщить о нарушениях правил, включая бандитизм и преследование. Внесите свой вклад, чтобы остановить злоупотребления на Reddit!",negative,neutral,positive,neutral
"Я делаю это! Мы все услышали сильный грохот и взрыв, и я подбежал, ожидая худшего. Действительно было чудо",positive,positive,positive,positive
"Берегите себя, дорогая.",positive,positive,neutral,positive
Напомни мне! 5 месяцев,neutral,neutral,very positive,neutral
[ИМЯ] НИКОГДА НЕ ИСПОЛЬЗУЕТ [ИМЯ]! ОН ХОРОШИЙ МАЛЬЧИК!,positive,negative,very positive,positive
"ты поймал меня на секунду. Я подумал: «Ух ты… это какая-то странная вещь — найти х-ох, черт возьми!» подловил. XD",neutral,neutral,neutral,positive
«Сайклоны штата Айова» — моя любимая баскетбольная команда колледжа.,positive,positive,neutral,positive
"Да, и они нанимают выпускников ПТУ с гораздо более низкой зарплатой. Выпускник университета обычно более разносторонний и компетентный.",neutral,neutral,negative,negative
"Да, попытаться купить отношения, хорошая идея...",negative,neutral,positive,positive
"Обожаю это начало, мальчики",positive,positive,positive,positive
"Я чувствую себя в безопасности рядом с тобой, это приятно",positive,positive,positive,positive
"Ааааа, тебе стоит начать кричать и трястись. Какой нафиг плохой аргумент. Теперь я верю в невидимых драконов.",negative,negative,very negative,negative
"Ну, вряд ли это проблема этой другой женщины. Вы производите впечатление ожесточенного, незрелого инцела, так что, возможно, разберитесь в своем отношении, прежде чем пытаться кого-то привлечь.",neutral,neutral,very negative,negative
"Надеюсь, с тобой всё в порядке, я чувствую этот пост :( крепкие объятия от меня",neutral,positive,positive,positive
"Что? Что плохого в том, чтобы сделать G заряжаемым персонажем?.. Ох, да, Q, я забыл.",negative,negative,very negative,negative
"Тогда вы/он, должно быть, отлично справляетесь со своей работой. Я никогда не сталкивался с одним.",positive,positive,positive,positive
"Ты настолько молод, насколько себя чувствуешь 😄",positive,positive,very negative,positive
"[ИМЯ] — золотоискательница, но на самом деле она очень классная девчонка",neutral,positive,negative,positive
"Помните, если что-то пойдет не так, давайте не будем вмешиваться в закон, одна рука моет другую. О, это напоминает мне.",neutral,neutral,negative,negative
"Вот это была бы интересная игра! Хотя я не совсем уверен, что это именно тот матч, который мне нужен. Ржу не могу",neutral,neutral,negative,positive
"[ИМЯ] разрушил религию. Это единственное хорошее, что они сделали.",positive,negative,very positive,positive
"Ага. Вы видите больше рук, вам нужно больше учиться, чтобы быть конкурентоспособными.. и т. д.",positive,neutral,negative,neutral
"На днях я, наверное, попробую 😅",positive,positive,very positive,positive
Спасибо брат,positive,positive,neutral,positive
С днём торта [ИМЯ],positive,positive,neutral,positive
"Спасибо, что предупредили, но мы рискнем справиться с этой серьезной опасностью.",positive,neutral,very negative,negative
"Я принимаю SNRI, десвенлафексин, и, честно говоря, это изменило мою жизнь. У меня нет побочных эффектов от этого, тогда как СИОЗС сделали меня хуже.",positive,negative,negative,positive
"Прохладный! Мой [ИМЯ] служил в батальоне маори, мне всегда интересно, есть ли там какие-нибудь его фотографии.",positive,neutral,positive,neutral
Ой. :[,neutral,neutral,neutral,negative
"Больше заинтересован в получении ответов на мои вопросы, а не в загадочных подсказках! Не уверен в актуальности вашего вопроса.",positive,neutral,negative,neutral
"Как будто смотришь в зеркало. Я чувствую тебя, чувак, я чувствую тебя.",neutral,neutral,very positive,positive
Я не могу представить себя таким пенсионером,negative,neutral,negative,negative
"Да, вы должны сказать им и сообщить в полицию о том, что он встречается с несовершеннолетней и дает ей сигареты.",negative,negative,negative,negative
Это чудо! Так начинаются религии.,positive,positive,very positive,positive
"Я надеюсь, что Даллас приблизится к этому и проиграет в разбитом сердце.",negative,neutral,positive,positive
"И все же вы все еще не заставляете меня сожалеть о том, что я был телевизионщиком, когда это шло, и поэтому скучал по нему.",neutral,negative,negative,negative
это полная ерунда... вот почему я не так сильно люблю Reddit,negative,negative,very negative,negative
"Я хотел знать, есть ли во всей этой истории с селфи еще одно подобное значение, а не нравлюсь я ей или нет.",neutral,neutral,negative,neutral
"Точно так же не было никакой благодарности или внимания к тому, что они только что дали ей «выходной».",negative,neutral,negative,negative
"Спасибо за совет, я ценю это.",positive,positive,neutral,positive
