text,label,pred_rubert_tiny2 (seara),pred_multilingual_tabularisai,pred_xlm_roberta_multilingual (cardiffnlp)
"> Я уверен, что многие из нас прошли через это. Командирован.",neutral,neutral,positive,neutral
Спасибо! :),positive,positive,positive,positive
"Лично не я, но я думаю, что это отличная идея. Никогда не знаешь, когда может возникнуть болезнь желудка.",negative,neutral,very negative,positive
"Да ладно, как бы гладиаторы отпустили [ИМЯ]?",negative,neutral,neutral,negative
"Американская версия «Офиса» — даже не лучшая версия «Офиса», не говоря уже о лучшей комедии.",positive,neutral,negative,negative
"Вау, это неуклюже.",neutral,neutral,negative,negative
"Это прекрасно, потому что это ужасно. Не с.",negative,positive,negative,negative
"Бро, это всего лишь игра, зачем тебе злиться?",negative,neutral,very negative,negative
"Если вы находитесь в северном полушарии, вы должны подписаться на [ИМЯ] «сезонную теорию сала».",neutral,neutral,neutral,neutral
Реформизм [ИМЯ] все еще слишком радикален для Уолл-стрит.,negative,neutral,negative,negative
"Невозможно? По крайней мере, я об этом не слышал.",negative,neutral,negative,neutral
"Я рад, что она облегчила тебе задачу настолько, насколько это возможно.",positive,positive,positive,positive
Теперь я не могу это не услышать...,neutral,neutral,negative,positive
"Извините, я пошутил",negative,neutral,positive,negative
"Я понял кульминацию, как только прочитал «Приливные капсулы», и возненавидел за это и себя, и тебя. Возьмите свой голос.",negative,neutral,positive,negative
"Помните, у нас все еще есть чертова Аляска.",positive,neutral,positive,neutral
У этих игроков много травм. Ненавижу рассчитывать на них.,negative,negative,negative,negative
"Даже прочитав все ваши посты, я так и не поняла... 😑",negative,neutral,very negative,negative
"Часть кота? Хаха, его передние лапы похожи на кошачьи. Такой пушистый мальчик.",positive,neutral,very negative,positive
"""Мне очень жаль! Это вовсе не входило в мои намерения. Мои извинения» так очаровательно. Хотя они предупреждают вас",negative,negative,very negative,negative
"Вы так ужасны во всем, что не соответствует вашим предпочтениям?",negative,negative,very negative,negative
">Должен любить Юг. Нет. Нет, на самом деле это не так.",negative,neutral,negative,neutral
"Я не знаю, что тренерский штаб говорит нашим игрокам, но в защите мы не играем ни умно, ни жестко.",positive,neutral,negative,negative
"Фанаты «Селтика» мне нравятся больше, чем фанаты «Бака».",positive,neutral,negative,positive
"Мне бы хотелось получить обновленную информацию о том, что произошло! (Когда ты готов)",positive,neutral,positive,neutral
"социально слабый ребенок, который также: - нейротипичен - не слишком низок - не слишком уродлив, так что в основном норма",neutral,neutral,negative,neutral
"Да, пожалуйста! ОуО",neutral,neutral,very positive,positive
Чертова парковка посреди улицы по всей полосе Аллегейни.,negative,neutral,neutral,neutral
Почему проблема исключить его из списка из 40 человек? Просто поместите его на 60-дневную DL.,negative,neutral,neutral,negative
"Когда я был ребенком, я больше всего влюбился в [ИМЯ] из «Жен футболиста». Ей сейчас чертовски тяжело.",positive,negative,negative,negative
"Я не помню, чтобы это происходило",negative,neutral,negative,negative
В этом плане Шампейн странный город..,negative,neutral,positive,negative
"Вы имеете в виду... мне **не** нужно быть #благословенным и #благодарным за то, что я переезжаю в другую страну в конце этого месяца?",positive,neutral,negative,neutral
"Пошел в другое их место в национальном парке Кэпитол-Риф, и это было фантастически. Тесто из цветной капусты великолепно, даже если вы не любитель безглютеновой еды.",positive,neutral,positive,positive
Я скучаю по тортам с конфетти :(,negative,negative,negative,negative
"[ИМЯ] был действительно хорош в этой игре, и я думаю, что он также хорош против Койотов.",positive,positive,positive,positive
"Для меня совершенно очевидно, что он все еще любит ее. Он определенно не влюблен в [ИМЯ], брак будет катастрофой.",negative,negative,very negative,negative
Типа... как это возможно? Ебена мать,neutral,negative,very negative,negative
"Выздоравливай скорее, мой человек! Продолжайте представлять остров! 🇵🇷",positive,neutral,very positive,positive
"Могу я просто сказать тебе, как мне понравилось, как ты постоянно натыкаешься на этого парня? Как святое дерьмо.",negative,negative,positive,negative
Спасибо! Я просто был таким раздражительным. Я горжусь собой и своим мужем тоже.,positive,positive,positive,positive
...даже одним и тем же человеком,neutral,neutral,negative,neutral
"это напоминает мне то время, когда [ИМЯ] купил Бофо лол",positive,neutral,neutral,neutral
"Я буду какать на вечеринке и скажу, что если только он не инвалид, хотя я искренне сомневаюсь, что этот ребенок инвалид.",positive,neutral,very negative,negative
Я сделал свою часть работы.,neutral,neutral,positive,positive
"Проблема в том, что люди не могут отличить необходимое условие от достаточного.",negative,neutral,neutral,negative
"это ГАНГСТЕРСКОЕ откровение!!!!. спасибо, г-н. [ИМЯ]!",positive,positive,very positive,positive
> для одиночных игроков Играть. Наемник. Плейлист. :),neutral,neutral,neutral,positive
Моя фамилия состоит из 4 букв. Это обычное английское слово. Его до сих пор постоянно неправильно произносят и пишут с ошибками.,neutral,negative,neutral,negative
Получать. Оплаченный. Предварительно. Вы усвоите этот урок только один раз.,neutral,neutral,negative,neutral
"Все, что имеет значение, это то, как вы используете эти четыре дюйма.",neutral,neutral,neutral,neutral
Ты умрешь.,negative,neutral,very positive,negative
Почему это здесь?,neutral,neutral,neutral,negative
"В этой «тяжелой работе» обычно мусорщик нажимал Q, так что я не собираюсь лить слезы.",neutral,negative,negative,neutral
"если не очевидно, что у всех проблемы с этим мошенническим сайтом",neutral,negative,negative,negative
> Не то чтобы использование облигаций было хуже или что-то в списке могло бы отличаться.,neutral,neutral,negative,negative
"Возможно, это похоже на то, как [ИМЯ] ненавидит дыню.",negative,neutral,very negative,negative
"Да я бы, наверное, расплакалась на месте. Громкие, внезапные и особенно пронзительные звуки чрезвычайно «неприятны»*, неудобны и вызывают стресс.",negative,negative,very negative,negative
"но эта девушка сказала не целоваться, ей просто нужен приятель по обнимашкам до замужества XD",positive,neutral,negative,positive
"[ИМЯ], но они все, похоже, искренне довольны своей жизнью и поддерживают друг друга, так что я тоже рад за них.",positive,positive,very positive,positive
"Твоя задница после того, как я так сильно тебя избил, что ты обосрался",negative,negative,very negative,negative
"[ИМЯ] изменяет тебе через несколько месяцев. Ваш любовный интерес из ME1 ждал вас два года, и они думали, что вы мертвы.",positive,neutral,very negative,neutral
"Мне нравятся все, в зависимости от того, чему я хочу научиться. Мне очень нравится стиль [ИМЯ] и [ИМЯ], потому что они такие тролли.",negative,positive,positive,positive
"Могу помочь, пишите в личку :)",positive,neutral,positive,positive
"это действительно не здорово? он, вероятно, стрелял в оленей любого пола и не задумывался об охоте.",negative,neutral,very negative,negative
"Нон-стоп в чате, это все, на что он отвечал",neutral,neutral,positive,neutral
"Нет, этот сабвуфер предназначен для того, чтобы хорошо собрать воедино непопулярные мнения. Это слишком мало усилий.",negative,neutral,negative,neutral
На ее месте я бы открыл дверцу машины и как следует погладил явно хорошего мальчика.,neutral,positive,positive,negative
Я никогда не просыпался от веера вокруг моего горла.,neutral,neutral,very negative,positive
"Для начала наймите адвоката. Будь готов. Не сидите на заднице и не шлепайтесь. Выясните, чего вы действительно хотите, и затем сделайте это.",positive,neutral,positive,neutral
"Девушка сильно выросла с тех пор, как ей было 12 лет в сериале, и она выросла такой красивой.",positive,neutral,positive,positive
Ни у кого нет на это денег. Ну и шутка,positive,neutral,very negative,negative
"Я чувствую себя глупо из-за того, что не посмотрел ее биографию, но у меня есть еще несколько фотографий.",negative,neutral,negative,negative
"Черт возьми, они ему дают не мои деньги. Мне нужен вратарь с показателем 0,970% даннаббит.",negative,neutral,very negative,negative
"Обменяйте [ИМЯ] и посмотрите, сыграет ли он [ИМЯ] против [ИМЯ]. посмотрим, с каким тренером мы здесь имеем дело.",neutral,neutral,neutral,neutral
"> Ничего не сказано о том, что его собираются перевести. Вся эта тема именно об этом, придурок.",neutral,negative,negative,neutral
"Отлично спасибо!! [ИМЯ] на этой неделе и [ИМЯ] на следующей неделе, я все ближе и ближе к тому, чтобы получить их всех!! :)",positive,positive,very positive,positive
"[ИМЯ], ты раздражаешь. [ИМЯ] украл твою девушку или что? Каждый раз, когда кто-то упоминает [ИМЯ] в этом субреддите, вы, кажется, ругаете его.",negative,negative,very negative,negative
"Ваши аргументы настолько плохи, что вы теперь просите людей отрицать здравый смысл, потому что вы не можете доказать свою точку зрения, лол, супер жалко",negative,negative,very negative,negative
"Вы рады, что Австралия в такое время играла в политику? Это не вотум доверия [ИМЯ].",positive,neutral,neutral,positive
"лично я заметил, что некоторые из наших сарказмов становятся темнее, чем обычно, так что я не знаю, я думаю, они очень сильные",negative,neutral,positive,neutral
"Все об этом говорят, но мне интересно, увеличивает ли это риск рака простаты. Вы знаете?",neutral,neutral,negative,neutral
"> LEGO Star Wars The Complete Saga Лучшая лего-игра, хотя это просто",positive,positive,very positive,positive
"Нет. К черту его. Это ответственная работа. Физически и эмоционально истощает. Ты заслуживаешь горячей еды и часа-двух, чтобы расслабиться.",negative,negative,positive,negative
"Ваша логика довольно запутана, и предположение о позиции не имеет к этому никакого отношения. Централизованный майнинг лишит возможности борьбы с цензурой.",neutral,neutral,negative,negative
Лед в его венах... Д'Л❄,neutral,neutral,neutral,positive
Новый вкус! Я люблю это!,positive,positive,positive,positive
"Я удивлена, что [ИМЯ] не расстегнула это платье, когда наклонилась к [ИМЯ]",neutral,positive,negative,positive
К черту твой дерьмовый титул,negative,negative,neutral,negative
Просто будьте уважительны.,positive,neutral,positive,neutral
"Лол, само по себе мышление «буквально» — это «большое слово», с примесью слишком глупости, чтобы понять контекст сверху.",positive,neutral,negative,negative
"Пистонс придется расстаться с чем-то, от чего фанаты не захотят отказываться. Хаха",positive,neutral,negative,positive
Тебе 17.... успокойся.,neutral,positive,positive,negative
"С днём тортика! Хорошего дня и года, ура.",positive,positive,positive,positive
"Серьезный вопрос, где это было? Это похоже на мою бывшую в зеленом топе.",negative,neutral,very negative,negative
"Мне бы хотелось, чтобы этот период прошел по-другому.",negative,neutral,negative,negative
Скачайте приложение - там есть ваш боевой послужной список и статистика последних матчей..не понимаю в чем проблема.,negative,neutral,positive,negative
Этого еще не произошло. Просто поговорите с руководителем или отделом кадров. А пока не занимайте неприятностей.,positive,negative,negative,neutral
"Всегда и я ценю ваше мнение, сэр.",positive,neutral,positive,positive
"Мне нравится, как все эти подозреваемые приветствуют [ИМЯ] как старого друга.",positive,positive,positive,positive
Аморальные социальные нормы следует нарушать.,positive,neutral,neutral,negative
Сразу после игры у меня случился сильный понос. Это было приятнее той потери.,negative,neutral,positive,negative
"Люди, которые ненавидят [ИМЯ], действительно ненавидят его. Это довольно увлекательно.",negative,neutral,positive,positive
"ха, вряд ли. возможно, самый большой город. Россия чертовски огромна.",neutral,neutral,very positive,positive
"Вы выбираете [ИМЯ], вы получаете то, за что голосуете, Юта. Поздравляем, вы получили то, за что голосовали. В следующий раз голосуйте умнее.",negative,neutral,neutral,positive
"Конечно, это справедливый вопрос. Криминальные драмы во многом преувеличивают важность чтения прав [ИМЯ], поэтому у большинства людей одинаковые заблуждения.",negative,neutral,negative,neutral
Проход на широкое поле [ИМЯ] ?,neutral,neutral,neutral,neutral
Некоторые вещи хуже смерти. Быть коровой на молочной ферме — одно из них.,negative,neutral,negative,negative
"Самое печальное, что они сделали бы что-то подобное. Полностью одержим Грин Бэй вместо того, чтобы улучшать состав или команду.",neutral,neutral,very negative,negative
Я чувствую запах ууууу,positive,positive,positive,positive
"ОООООФФ, вот это будет пинком по голове",negative,neutral,very negative,negative
"наверное, это худшие прессы, которые я когда-либо видел, извини, приятель",negative,neutral,very positive,negative
Тебе нужно перестать сосредотачиваться на нем и сосредоточиться на себе и своей дочери.,neutral,neutral,neutral,neutral
"Вот почему вариант не «будьте точным», а «будьте настолько точным, насколько можете».",negative,neutral,negative,neutral
"О боже, каждый раз, когда кто-то спрашивает, сколько сейчас времени, мой первый порыв - сказать: ""пора обедать!""",neutral,negative,very positive,neutral
Лучшая идея урока FHE.,positive,positive,very positive,positive
"Я удивлен, что он выжил на праймериз.",positive,neutral,positive,positive
"Очевидно, это был юмористический комментарий. Но я почти уверен, что могу догадаться, за что вы проголосовали :P",positive,neutral,very positive,positive
"Я в порядке с жалобами. Немного удивлен, что он жалуется, не играя и даже не читая описания обновлений с момента их выпуска.",positive,neutral,negative,positive
"Спасибо, приятель, выглядит очень круто.",positive,positive,positive,positive
В этом есть смысл. О чем здесь спор?,neutral,neutral,neutral,neutral
"Может быть, он просто никогда не хотел быть главным тренером и довольствовался ролью координатора защиты? В любом случае, я в восторге!",positive,positive,very positive,positive
"Вы предложили этому парню контракт, а он вам отказал. Наверное, не мог себе его позволить, лол",negative,negative,very negative,negative
:) Мне это нравится.,positive,positive,positive,positive
"Этот парень просто не съежился, это было жутко",negative,negative,very negative,positive
"Мне это понравилось гораздо больше, чем я думал! [ИМЯ] проделал потрясающую работу с весьма причудливой концепцией!",positive,positive,very positive,positive
"Маловероятно, что гонщику снова предъявят обвинение.",negative,neutral,positive,negative
"Я понимаю вашу точку зрения. Но я все равно лучше украду что-нибудь, чем потеряю члена семьи.",negative,neutral,negative,negative
"эээ, я не вижу корреляции между тоннами изнасилований и убийств в Джорджии и необходимостью повышения налогов на богатых, но я согласен.",neutral,negative,negative,neutral
"Ну, я сын родителя, который легально иммигрировал из [РЕЛИГИЙНОЙ] страны Турции, так что нет, спасибо, придурок.",negative,neutral,very negative,neutral
"Мне всегда нравилось, когда [ИМЯ] просто говорил, что мы все забываем, что он буквально выиграл новичка года. Я знаю, что это было без конкуренции, но все же.",positive,positive,positive,positive
"И я рад, что мы все согласны, что это дэткор.",positive,positive,positive,positive
"Я голосую за это идеальное возвращение, но мне это не нравится!",neutral,neutral,very negative,negative
"Ага. Если бы они действительно протестировали свой патч, они бы узнали об этих вещах.",positive,neutral,negative,neutral
Обновление: я все еще люблю футбол,neutral,positive,positive,positive
"Пришёл к ней на лицо и она сказала тебе? Вау неуважение. Либо она не знала, что ты на самом деле чувствуешь, либо ей было все равно. Извините за вашу удачу",negative,negative,negative,negative
Странный. Меня это всегда возбуждает.,neutral,neutral,very negative,positive
"Да, это неожиданно, но мне придется это удалить, потому что это не сатира и не контролирование.",negative,neutral,very negative,negative
"Просмотрел 4 или 5 серий и мне было все равно. Слышал, что с первого сезона стало лучше",negative,neutral,neutral,positive
Лол хороший разговор,positive,positive,positive,positive
"Придется провести для него несколько пьес, его охраняют довольно жестко.",neutral,neutral,negative,neutral
"Значит, он дал что-то другое? все будет хорошо",positive,neutral,positive,positive
"Нет, он не 😂😂😂 его нога задела голову, и это явно был несчастный случай..",neutral,negative,negative,negative
Проклятие. Твоя кровать должна вонять,negative,negative,neutral,negative
"Слишком ленив, чтобы напечатать ""его/ее"" 3 раза. Это и я не даю ебать.",negative,negative,negative,negative
"Наверное, это хорошая идея. Позвоните им и узнайте, смогут ли они вам помочь.",positive,neutral,positive,positive
