text,label,pred_rubert_tiny2 (seara),pred_multilingual_tabularisai,pred_xlm_roberta_multilingual (cardiffnlp)
"Надо любить всех фальшивых фанатов, которые ничего не знают о хоккее!",negative,neutral,positive,positive
Я <3 тебя!,positive,neutral,positive,positive
Это странный ответ.,negative,neutral,negative,negative
"О, это имеет смысл, просто я в основном думаю об уборщиках как о работниках частного сектора, даже в правительстве (независимые подрядчики и т. д.).",neutral,neutral,positive,neutral
"Ненавижу вкус, перешёл на пластиковую бутылку налгена.",negative,negative,negative,negative
"Он сказал, что большие инвестиции определенно не будут потеряны, если эта субмарина вернется в нужное русло. Тот факт, что пост плохой, не означает, что он потерян.",positive,negative,very negative,neutral
Нет чувак! Разве ты не понимаешь?! Женщины как кошки! /с,negative,neutral,very negative,negative
"Ах. Я должен был заметить это после того, как моя бабушка поделилась этим на Facebook.",negative,neutral,negative,neutral
"Я предпочитаю покупать сундуки победителей и удерживать богоподобные сундуки, пока в них не появится нужный мне скин.",negative,neutral,negative,neutral
Я здесь с дьявольским топором и 34 шансами на крит. И мой топор-убийца только что сломался.,negative,negative,very negative,negative
Отравлен своими врагами.,negative,neutral,positive,negative
"Несколько раз, но у таких людей короткая концентрация внимания/заботятся только тогда, когда телевизор говорит «тоже».",neutral,neutral,negative,negative
"Респект ВАМ за такую ​​признательность, сэр. :) Не часто такое увидишь. Удачи!",positive,positive,negative,positive
"MRW кто-то спрашивает меня, что это за новое раздражающее приложение, которое постоянно рекламируется на Youtube.",negative,neutral,positive,negative
"Вау, спасибо. Могу поклясться, что приложение Score показывало 15:00, когда я проверял его два дня назад.",positive,positive,neutral,positive
"Когда они перестанут платить по счетам AWS, цифровая витрина исчезнет.",neutral,neutral,neutral,negative
Не было бы другого пути. К черту мою ДНК. К черту нуклеотиды.,negative,negative,neutral,negative
Мои дети никогда бы больше не заснули. Хотя вы лучше всех знаете темперамент своих детей.,neutral,neutral,negative,negative
"Кто-то сделал. Человек, который их оплодотворил. Люди не размножаются бесполым путем, вы не можете просто забеременеть.",neutral,negative,positive,neutral
"Потому что они заявляют, что выступают против [ИМЯ], и им нужно что-то под названием «голоса», чтобы победить его?",negative,neutral,neutral,negative
"Мама расстроится. [ИМЯ] все еще в порядке. Общаться с друзьями по-прежнему хорошо. Деньги, покупающие опыт гурманов, по-прежнему хороши.",negative,neutral,positive,positive
Мне нравится подкаст His And Hers Poker,positive,positive,positive,positive
"Это абсолютно самый глупый издевательство, которое я видел в этом году",positive,negative,very negative,negative
"Серебро на самом деле неплохо с точки зрения людей, играющих в хорошие игры... именно когда вы доходите до низкого и высокого золота, мне нравится серебро, ммао.",neutral,neutral,positive,positive
Это минус,neutral,neutral,neutral,negative
"Честно говоря, я постоянно шокирован тем, что более 35% населения действительно думают, что он делает хорошую работу.",neutral,neutral,positive,positive
Преступления более зловещего невозможно себе представить!,negative,negative,negative,negative
"Мне нравится это название, забавно представить, как жестокое озеро крадет собак! :)",positive,negative,positive,positive
"Мне также нравится, что ее исправление было неправильным. Но вся суматоха на Острове может сделать это с человеком.",positive,neutral,negative,negative
"Провел с ними время. Спорьте с ними. Смейся вместе с ними. Плачьте вместе с ними. Нам всем становится одиноко, когда мы стареем.",neutral,neutral,positive,positive
"Лайфсайт «Новости» доксировал его. Этот сайт — это просто дистиллированная ненависть, это отвратительно.",negative,negative,very negative,negative
"Что они означают, привлекают подростков? Практически каждый подросток уже этим занимается.",positive,neutral,neutral,neutral
ЭТОГО НЕ ПРОИСХОДИТ!,negative,negative,very positive,neutral
Уже несколько дней освежаюсь в надежде на новости о Мунчаке!,neutral,positive,positive,positive
"Спасибо за это, я хочу узнать больше о наших потенциальных клиентах, и это помогает.",positive,positive,negative,positive
Это должно быть желанием каждого.,positive,neutral,negative,neutral
"Никогда не любил хип-хоп. Вырос на гангстерском образе жизни и ненавидел его. Я также смеюсь над «мифологией», которая выросла вокруг этого.",negative,negative,negative,negative
Добро пожаловать в мой мир. фмл,neutral,positive,positive,positive
"О, привет, мы делаем круговой рывок в зеленой шляпе?",neutral,neutral,neutral,neutral
"Без обид, но вы делаете поспешные выводы, которые могут быть столь же неверными, как и обвинение [ИМЯ].",negative,negative,negative,negative
"этот мем настолько старый, что вернул меня в 2011 год",negative,neutral,negative,positive
"Альтернатива [ИМЯ] ни у кого не вызвала энтузиазма, а жадность, антилиберализм и эгоцентризм не ограничиваются какой-либо этнической группой.",negative,negative,very negative,neutral
"Безумный два плеер, классный",neutral,positive,positive,positive
"Вы, должно быть, здесь новенький, если это самое отвратительное дерьмо, которое вы когда-либо видели.",positive,negative,very negative,negative
Нуллл... это взгляд.,positive,neutral,neutral,neutral
Я болею за Wild в этом году,positive,neutral,negative,negative
"Что ж, тогда мне жаль мужчин за то, что они такие неконтролируемые сексуальные звери, я думаю. Мой первоначальный ответ был искренним, хотя я не могу говорить за других.",negative,negative,very negative,negative
"Мне просто интересно, все те люди, которые обвиняли тебя в неверности, что они говорят сейчас?",neutral,neutral,very positive,neutral
Ой. Тяжелый год для зубцов. Где ты на севере штата?,neutral,neutral,neutral,negative
"Я молюсь в пространстве, которое есть внутри моего грузовика :)",positive,neutral,neutral,positive
Мне он кажется очень светло-голубым.,neutral,neutral,positive,positive
"Представьте себе, что они придумают через десять лет.",neutral,neutral,positive,neutral
"Аааа, старый хет-трик с сахарной ватой.",neutral,positive,neutral,negative
"Нет, это сексуальное расстройство из-за того, что структура мозга не соответствует структуре тела, но я думаю, что по-прежнему остаюсь невежественным трансфобом.",negative,negative,very negative,negative
Меня не волнует эта миссия в Техасе.,negative,neutral,negative,neutral
"Если бы ничего не было сказано и завтра ты можешь быть занят весь день, я бы не волновался.",negative,neutral,negative,neutral
"И если ты когда-нибудь пошутил на Reddit о толстом полицейском, то ты худший преступник на свете!",negative,negative,very negative,negative
[ИМЯ] 3!,neutral,neutral,neutral,neutral
"Ну, в идеале, в любом случае, следует чистить пирсинг стерильным физиологическим раствором.",neutral,neutral,neutral,neutral
"Ага. Именно это заставило меня впервые поцеловать свою ТАК. Эти глаза. Не думаю, что когда-нибудь забуду.",neutral,neutral,very negative,positive
"Я чувствую вашу боль 😪 В ноябре меня обманули на 1400 долларов. Я тоже чувствовал себя тупицей из-за того, что попался на это.",negative,negative,very negative,negative
"Я уверен, что ей бы это понравилось, возможно, она тоже напугана!",neutral,positive,very negative,neutral
Теперь она его проблема.,positive,neutral,negative,negative
"Я к этому не готов, поэтому не поверю.",neutral,neutral,negative,negative
Краудер ужасен... Как можно проиграть эту перестрелку или не хватило здравого смысла просто убежать?,negative,negative,very negative,negative
"Вы все просто завидуете, что этот человек идентифицирует себя как рыболовный крючок. А если серьезно, то прохождение таможенного контроля в аэропорту должно быть кошмаром.",negative,neutral,very negative,negative
"DonutLicious in Spring — самый изысканный ресторан, в котором я когда-либо был.",positive,positive,very positive,positive
"Правительство помещает DUP и обезьян в одни и те же цифры, поэтому трудно угадать.",neutral,neutral,neutral,negative
"Хорошо, я почти уверен, что [ИМЯ] был частью основного состава с первого эпизода...",neutral,neutral,positive,neutral
"Отметьте друга, который просыпается сексуально возбужденным",neutral,neutral,neutral,neutral
"Спасибо, [ИМЯ]!! Я говорю, что нам следует добавить [ИМЯ] в команду!",positive,positive,very positive,positive
"Ты выиграл, я ошибаюсь, думая, что кто-то воспользуется этим.",neutral,neutral,negative,negative
"О боже, какой простой блеск. НБМЕ - пустая трата времени!? Гений!",positive,negative,very negative,positive
"Я искренне удивлен, что [ИМЯ] не поверил речи [ИМЯ] о помаде - как будто эта чушь меня искренне тронула",neutral,positive,very negative,negative
[ИМЯ] черт возьми,negative,negative,neutral,negative
"Это интересно, но было бы крайне непрактично в качестве протеза для человека с ампутированной конечностью или человека с деформацией конечности.",positive,neutral,negative,negative
"Я хотел бы добавить, что вы спонтанно испытываете бесконечную ненависть к себе, потому что вы внезапно вспомнили тот неловкий поступок, который вы сделали 3 года назад.",neutral,negative,negative,negative
"Я ничего не знаю об израильской политике, кроме того, что [ИМЯ] ужасен, и я надеюсь, что он проиграет.",neutral,negative,very negative,negative
"Разве я не должен иметь то, что хочу? Что мне нужно?!?",negative,neutral,very negative,neutral
Я понимаю. Вот почему у них есть ограничение по времени. Даже если это просто переоценка.,positive,neutral,negative,neutral
"Как и [ИМЯ], если вы хотите быть очень разборчивыми.",neutral,neutral,negative,neutral
С какими-то странными кошачьими придатками,negative,neutral,negative,negative
"Публикуйте посты на [ИМЯ] и слушайте инфовойны, у вас не должно быть своего мнения в интернете и вы не должны его разделять",neutral,neutral,negative,negative
"Я не думаю, что он смог бы успеть на этот автобус, если бы не врезался в столб.",negative,neutral,negative,negative
"ты можешь использовать свою нечеловеческую силу орангутангов, чтобы разорвать их на части и ограничить, это вариант",positive,neutral,neutral,neutral
Это потрясающе.,positive,positive,positive,positive
"На основании чего именно. Мне, честно говоря, интересно, что вы так высоко цените из того, что есть в Америке?",neutral,neutral,very negative,negative
"Не пошел, но это убийственная фотография.",neutral,negative,positive,negative
Телефонные звонки в первые 10 минут абсолютно убийственны.,negative,negative,very negative,negative
"Как она закончила? (Отметьте все подходящие варианты) [ ] Готово. [ ] Итак, готово. [ ] Она даже не может.",neutral,neutral,very negative,neutral
"некоторым людям действительно нужна жизнь за пределами дрэг-рейсинга. не я, а некоторые люди.",neutral,neutral,positive,negative
"Кажется, я возвращаюсь на кухню :)",neutral,neutral,positive,positive
"Какой красавец, кто-нибудь знает, что это за порода?",positive,positive,very negative,positive
"Горячая чертовски! К счастью, только удар по голове.",positive,positive,positive,negative
Это ранний претендент на титул года 2019. Браво.,positive,neutral,negative,positive
"Им трудно повторять это, они идут и слишком рано получают обвинения.",neutral,neutral,negative,negative
"В целом да, это безумие, что 2 года спустя кто-то, кто выбрал 56 пиков позже, стал лучше как игрок.",negative,neutral,negative,negative
"Я просто подумал, что было бы упущением, если бы я не занялся этой темой.",negative,neutral,negative,negative
Это бьет пощечины. Хорошие воспоминания,positive,positive,very negative,positive
Где ты взял эти туннели? Я их обожаю и сама бы хотела!,positive,positive,very negative,positive
"Кому-нибудь это напоминает Рублев USO17 QF? [ИМЯ], очевидно, продвинулся дальше, чем [ИМЯ], но с результатами не поспоришь...",neutral,neutral,negative,positive
"Думаю, ты выиграешь *пожимает плечами*",neutral,positive,very negative,positive
Приятно слышать. Страшные несколько часов для вас всех.,neutral,positive,positive,positive
"Может быть, «поза силы» на вершине Белых скал отпугнет их всех?",neutral,neutral,neutral,neutral
"Сила воли. У меня много маленьких пристрастий, которым я поддаюсь. Пришло время получить контроль над своей повседневной жизнью.",positive,neutral,positive,positive
"Говоря о кошках, мой маленький друг только что прыгнул на диван *похлопал похлопал от хороших людей с Reddit*",negative,negative,very negative,positive
"Когда я представлял, как ты чихаешь и бьешься головой, я так сильно смеялся! ВОТ ЧТО ВЫ ПОЛУЧИТЕ! А теперь помолчи.",positive,positive,very positive,positive
"Не надо было так оскорблять Чунгуса, если я увижу тебя в тумане, тебя отправят в лагерь",negative,neutral,negative,negative
Скучаю по войне bch/bsv... качество постов становилось лучше.... возвращаюсь к исходной точке 1,positive,negative,neutral,positive
"Серьезно. Единственное, что выдавало это отсутствие орфографических ошибок.",negative,neutral,negative,positive
Шутка над тобой... он в сговоре с парнем из Оксфорда...,positive,neutral,very negative,neutral
### Потому что Шэгги такое могущественное существо,positive,neutral,neutral,positive
... но он ЛЮБИТ тебя. Идеальный.,positive,positive,very positive,positive
"Насколько я понимаю, сейчас это фактически авторитарное государство.",neutral,neutral,neutral,negative
"Единственные прочные союзы: [ИМЯ] и [ИМЯ] Я все еще думаю, что все нестабильно [ИМЯ] не разорвал все связи с [ИМЯ]",positive,positive,very negative,neutral
Теперь мы прошли полный круг,neutral,neutral,neutral,neutral
я звоню номеру [ИМЯ] с [ИМЯ] [ИМЯ],positive,neutral,neutral,neutral
"Надеюсь, его голые руки такие же чистые, как сковородка. С готовыми к употреблению продуктами следует обращаться в перчатках. Хотя очень крутая машинка.",positive,positive,positive,positive
Был на игре вчера и сейчас. Это жалкое гонг-шоу. Почему я продолжаю делать это с собой?,negative,negative,negative,negative
Я сэкономлю людям немного Google. 26 февраля.,positive,neutral,negative,positive
Ты не можешь быть серьёзным.,neutral,neutral,negative,negative
Новая идея названия: Мужчина подвергается нападению за высказывание своего (хотя и ужасного и отвратительного) мнения.,negative,neutral,neutral,negative
Мне очень жаль.....,negative,negative,very negative,negative
"MRW Я просто пытаюсь пережить свой день, и кто-то вспоминает Брексит или [ИМЯ]",neutral,neutral,very negative,neutral
Я взволнован!,positive,positive,very positive,negative
"Все в порядке, моя мама всегда меня ненавидела, и со мной все в порядке.",negative,positive,very positive,positive
"Хуже всего то, что он продолжает нарастать снежным комом и расти, и вдруг возникает такой беспорядок, в котором вы не можете найти смысла или разобраться.",negative,negative,very negative,negative
"Ах, это моя школа, но я еще не видел ее, нужно продолжать посещать",positive,positive,negative,positive
"Если бы это был Центральный транспорт, возможно, вам повезло. Иногда я задаюсь вопросом, есть ли у них вообще двери в трейлерах, вещи очень часто пропадают",neutral,neutral,negative,negative
[ИМЯ] необходимо предупредить людей.,negative,neutral,neutral,neutral
Ты имеешь ввиду,neutral,neutral,neutral,neutral
Это моя КОЗА,positive,positive,very positive,positive
"Да, но мне трудно найти клавиатуры стоимостью менее 60 евро с синими переключателями и nkro. Если у вас есть какие-то предположения, пожалуйста, оставьте ссылку.",neutral,neutral,negative,negative
"Да, как и моя жизнь *хлещет, пока рыдает",negative,negative,very negative,negative
"Добро пожаловать во взрослую жизнь, мой брат.",positive,positive,positive,positive
"Извините, я новичок в размещении здесь. Даже не знал, что такое существует! Попробую перебраться туда.",negative,neutral,positive,positive
"Кажется, у него действительно отличное чувство моды, может быть, однажды он сможет что-нибудь с этим сделать, может быть, поехать в Париж?",positive,positive,positive,positive
"Эй, это нормально",positive,positive,positive,positive
"Я просто хочу использовать все эти причудливые щиты, которые постоянно вырываю из рук гоплитов.",neutral,neutral,positive,negative
Это худшее чувство хаха,negative,positive,very negative,negative
"LMFAO: мы поднимаемся со счетом 2:0 и теряем название игры, более знаковый дуэт, смею вас",negative,neutral,neutral,positive
"2019 год должен быть просто картинкой горящего мусорного бака или мусорного контейнера. Удивительно, насколько дерьмово DICE может сделать вещи за 10 лет.",negative,negative,neutral,negative
"ЛПТ: Как только ты проснешься, сделай репост, твои виртуальные интернет-точки поднимут тебе настроение.",positive,neutral,neutral,positive
"Они сделают ME4, и, вероятно, [ИМЯ] просто скажет: «О, жнецы умерли от старости», если вы выберете контроль или синтез.",neutral,neutral,neutral,negative
